{
  "dataset": "mappable-records1.json",
  "constraint_profile": "data-collection-1.instructions.md",
  "progress": {
    "candidates_total": 30,
    "pending": 0,
    "validated": 30,
    "needs_verification": 0,
    "rejected": 0
  },
  "last_action": "Built the static map-first prototype from the 30 finalized records using the company project's Wemo styling and MapLibre/OpenFreeMap pattern.",
  "next_action": "Open HTML/shadcn/index.html for operator review; refresh HTML/shadcn/data.js whenever the finalized JSON changes.",
  "quality": { "status": "ok", "note": "All 30 candidates passed validation; the UI bundle matches the finalized JSON and uses one accessible marker per record." }
}
